{
  "$defs": {
    "disclosure": {
      "additionalProperties": false,
      "properties": {
        "checks": {
          "items": {
            "type": "string"
          },
          "type": "array"
        },
        "coverage": {
          "type": "object"
        },
        "policy": {
          "type": "string"
        },
        "publication_authorized": {
          "const": false
        },
        "status": {
          "enum": [
            "unknown",
            "operator_asserted",
            "checks_performed",
            "externally_verified"
          ]
        }
      },
      "required": [
        "status",
        "checks",
        "policy",
        "coverage",
        "publication_authorized"
      ],
      "type": "object"
    }
  },
  "$id": "https://sclite.local/schemas/public_validation_surface_index.v0.2.schema.json",
  "$schema": "https://json-schema.org/draft/2020-12/schema",
  "additionalProperties": false,
  "properties": {
    "artifact_type": {
      "const": "public_validation_surface_index"
    },
    "disclosure": {
      "$ref": "#/$defs/disclosure"
    },
    "generated_at": {
      "minLength": 1,
      "type": "string"
    },
    "non_claims": {
      "items": {
        "type": "string"
      },
      "type": "array"
    },
    "public_safety": {
      "type": "object"
    },
    "schema_version": {
      "const": "v0.2"
    },
    "summary": {
      "type": "object"
    },
    "surfaces": {
      "items": {
        "additionalProperties": false,
        "properties": {
          "commands": {
            "items": {
              "type": "string"
            },
            "type": "array"
          },
          "disclosure": {
            "$ref": "#/$defs/disclosure"
          },
          "kind": {
            "type": "string"
          },
          "path": {
            "minLength": 1,
            "type": "string"
          },
          "purpose": {
            "type": "string"
          },
          "schemas": {
            "items": {
              "type": "string"
            },
            "type": "array"
          },
          "surface_id": {
            "minLength": 1,
            "type": "string"
          }
        },
        "required": [
          "surface_id",
          "path",
          "kind",
          "purpose",
          "schemas",
          "commands",
          "disclosure"
        ],
        "type": "object"
      },
      "type": "array"
    }
  },
  "required": [
    "artifact_type",
    "schema_version",
    "generated_at",
    "surfaces",
    "summary",
    "disclosure",
    "public_safety",
    "non_claims"
  ],
  "title": "SCLite PublicValidationSurfaceIndex v0.2",
  "type": "object"
}
