{
  "artifact_type": "public_validation_surface_index",
  "disclosure": {
    "checks": [],
    "coverage": {
      "credentials": "not_checked",
      "private_paths": "not_checked",
      "raw_output": "not_checked"
    },
    "policy": "",
    "publication_authorized": false,
    "status": "operator_asserted"
  },
  "generated_at": "2026-05-05T21:30:00+00:00",
  "non_claims": [
    "does_not_claim_live_vulnerability_evidence",
    "does_not_authorize_publication",
    "does_not_cover_protocol_adapter_execution"
  ],
  "public_safety": {
    "live_target_execution": false,
    "protocol_adapter_work": false,
    "public_push_authorized": false,
    "raw_live_evidence_included": false
  },
  "schema_version": "v0.2",
  "summary": {
    "surface_count": 4
  },
  "surfaces": [
    {
      "commands": [
        "sclite review-lifecycle sclite/examples/contract-lifecycle-v0.2/artifact_chain_manifest.json --format json"
      ],
      "disclosure": {
        "checks": [],
        "coverage": {
          "credentials": "not_checked",
          "private_paths": "not_checked",
          "raw_output": "not_checked"
        },
        "policy": "",
        "publication_authorized": false,
        "status": "operator_asserted"
      },
      "kind": "json_artifact",
      "path": "examples/lifecycle-review/review_record.json",
      "purpose": "Validate a static lifecycle review aggregate and its scope-fidelity result.",
      "schemas": [
        "review_record.v0.1",
        "scope_fidelity_report.v0.2"
      ],
      "surface_id": "lifecycle_review_fixture"
    },
    {
      "commands": [
        "sclite review examples/review-bundle --format json",
        "sclite export-review-bundle examples/review-bundle --format markdown"
      ],
      "disclosure": {
        "checks": [],
        "coverage": {
          "credentials": "not_checked",
          "private_paths": "not_checked",
          "raw_output": "not_checked"
        },
        "policy": "",
        "publication_authorized": false,
        "status": "operator_asserted"
      },
      "kind": "review_bundle_directory",
      "path": "examples/review-bundle",
      "purpose": "Validate and export a canonical SCLite current lifecycle/review bundle.",
      "schemas": [
        "review_record.v0.1",
        "artifact_chain_manifest.v0.2"
      ],
      "surface_id": "review_bundle_fixture"
    },
    {
      "commands": [
        "sclite review examples/govengine-integration --format json --fail-on review",
        "sclite verify-secure-bundle examples/govengine-integration --guard /path/to/kernel_guard_manifest.json",
        "sclite validate-trust-profile examples/govengine-integration/trust_profile_ref.json --subject examples/govengine-integration/04_execution_ticket.json",
        "sclite validate-carrier-profile examples/govengine-integration/carrier_profile_ref.json --subject examples/govengine-integration/04_execution_ticket.json"
      ],
      "disclosure": {
        "checks": [],
        "coverage": {
          "credentials": "not_checked",
          "private_paths": "not_checked",
          "raw_output": "not_checked"
        },
        "policy": "",
        "publication_authorized": false,
        "status": "operator_asserted"
      },
      "kind": "review_bundle_directory",
      "path": "examples/govengine-integration",
      "purpose": "Validate the current downstream integration fixture for GovEngine consumption.",
      "schemas": [
        "review_record.v0.1",
        "artifact_chain_manifest.v0.2",
        "execution_ticket.v0.3",
        "trust_profile_ref.v0.1",
        "carrier_profile_ref.v0.1"
      ],
      "surface_id": "govengine_integration_fixture"
    },
    {
      "commands": [
        "sclite review examples/local-admin-change --format json --fail-on review"
      ],
      "disclosure": {
        "checks": [],
        "coverage": {
          "credentials": "not_checked",
          "private_paths": "not_checked",
          "raw_output": "not_checked"
        },
        "policy": "",
        "publication_authorized": false,
        "status": "operator_asserted"
      },
      "kind": "review_bundle_directory",
      "path": "examples/local-admin-change",
      "purpose": "Validate the current local-admin-change fixture as a non-security multi-runtime proof surface.",
      "schemas": [
        "review_record.v0.1",
        "artifact_chain_manifest.v0.2",
        "execution_ticket.v0.3"
      ],
      "surface_id": "local_admin_change_fixture"
    }
  ]
}
